url,views,days,name
https://www.triphobo.com/tripplans/dublin-edinburgh-london-trip-from-boston-55184ce0fbc2e55d1f00024b,1810,16 Days,"Trip to London, Edinburgh, Dublin"
https://www.triphobo.com/tripplans/united-kingdom-ireland-trip-from-sydney-551e3264e70545051b000078,1715,20 Days,"Trip to London, Edinburgh, Dublin, Cardiff"
https://www.triphobo.com/tripplans/europe-asia-trip-from-bangalore-556b1441fac2e554420002ca,1633,20 Days,"Trip to Paris, Berlin, Rome, Bangalore, London, Moscow, Edinburgh, Istanbul, Zurich"
https://www.triphobo.com/tripplans/dublin-edinburgh-london-trip-from-boston-55185f97fbc2e5ba130004a2,1569,16 Days,"Trip to London, Edinburgh, Dublin"
https://www.triphobo.com/tripplans/united-kingdom-trip-plan-55a7a8b0ef616ebb05000831,1429,20 Days,"Trip to London, Edinburgh, Manchester, Cambridge, Bath, Oxford, Blackpool, Birmingham, Sheffield, Llandudno"
https://www.triphobo.com/tripplans/dublin-edinburgh-london-trip-from-portland-55348cf9fbc2e5b718000a48,1428,20 Days,"Trip to London, Edinburgh, Dublin"
https://www.triphobo.com/tripplans/europe-trip-from-rome-55e7d598cd2e075a78000735,1402,20 Days,"Trip to Paris, Venice, London, Florence, Edinburgh, Milan, Geneva, Ulm, Cardiff"
https://www.triphobo.com/tripplans/ireland-united-kingdom-trip-from-sioux-falls-559073acfbc2e55e430008ac,1400,19 Days,"Trip to Edinburgh, Galway, Cork, Dublin, Donegal, Kilkenny, Killarney"
https://www.triphobo.com/tripplans/united-kingdom-trip-from-mumbai-550fb243f9c2e5ff62000682,1354,13 Days,13 Day Trip to United Kingdom from Mumbai
https://www.triphobo.com/tripplans/ireland-united-kingdom-trip-from-chicago-55907476f9c2e5fe550007e8,1339,20 Days,"Trip to Edinburgh, Galway, Cork, Dublin, Donegal, Kilkenny, Killarney"
https://www.triphobo.com/tripplans/europe-trip-from-brisbane-55a710374615a7b90500038a,1312,20 Days,"Trip to Salzburg, Vienna, London, Munich, Edinburgh, Amsterdam, Budapest"
https://www.triphobo.com/tripplans/london-trip-from-nashville-54f931bafbc2e5050b00098b,1292,15 Days,Trip to London
https://www.triphobo.com/tripplans/europe-trip-from-los-angeles-55b9b9621aa23c0835000662,1263,20 Days,"Trip to Paris, Rome, London, Florence, Edinburgh, Dublin, Monaco, Barcelona, Madrid, Amsterdam"
https://www.triphobo.com/tripplans/edinburgh-trip-from-glasgow-551ea17dfbc2e5e007000220,1143,16 Days,Trip to Edinburgh
https://www.triphobo.com/tripplans/france-united-kingdom-trip-from-zurich-55850b31fac2e50b33000654,1132,20 Days,"Trip to Paris, London, Edinburgh, York"
https://www.triphobo.com/tripplans/edinburgh-itinerary-53623150e70545f90e000004,1117,4 Days,Trip to Edinburgh
https://www.triphobo.com/tripplans/europe-trip-plan-55d3c472900670d97c000206,1115,15 Days,"Trip to Paris, London, Edinburgh, Brussels, Dublin, Amsterdam"
https://www.triphobo.com/tripplans/united-kingdom-france-trip-from-delhi-55b736ea00fc94e012000caa,1109,19 Days,"Trip to Paris, London, Edinburgh, Cambridge, Bath, Oxford, Blackpool, Birmingham, Torquay, Sheffield"
https://www.triphobo.com/tripplans/europe-itinerary-from-invercargill-56010b123cb75eaf05000011,1034,49 Days,"Trip to Paris, Venice, London, Cannes, Edinburgh, Milan, Dublin, Barcelona, Madrid, Ibiza"
https://www.triphobo.com/tripplans/europe-trip-from-portland-5577258dfbc2e5071b000878,1019,18 Days,"Trip to Rome, London, Edinburgh, Glasgow, Cork, Dublin, Limerick, Pisa, Frankfurt, Kilkenny"
https://www.triphobo.com/tripplans/united-kingdom-ireland-netherlands-trip-from-denver-5507ab98fbc2e52d2a000962,1015,17 Days,"Trip to London, Edinburgh, Dublin, Amsterdam"
https://www.triphobo.com/tripplans/edinburgh-inverness-trip-from-london-55e6cba4f3a73d115e00013e,991,18 Days,"Trip to Edinburgh, Inverness"
https://www.triphobo.com/tripplans/europe-trip-from-bentonville-55d13c90a5e4d0a83300023d,988,20 Days,"Trip to Paris, Berlin, Rome, London, Edinburgh, Athens, Dublin, Madrid"
https://www.triphobo.com/tripplans/europe-trip-from-brisbane-55e02fc700fc94973f0002c7,965,20 Days,"Trip to Paris, Rome, London, Edinburgh, Galway, Dublin, Manchester, Liverpool, Donegal, Kilkenny"
https://www.triphobo.com/tripplans/edinburgh-itinerary-52e7da72e705451e0c000001,949,3 Days,Trip to Edinburgh
https://www.triphobo.com/tripplans/europe-trip-from-paris-5595b685f9c2e5b850000ac7,946,19 Days,"Trip to Edinburgh, Stockholm, Amsterdam, Oslo, Reykjavik, Copenhagen"
https://www.triphobo.com/tripplans/united-kingdom-france-ireland-trip-from-melbourne-5582556ffac2e54830000709,925,15 Days,"Trip to Paris, London, Edinburgh, Dublin, Manchester"
https://www.triphobo.com/tripplans/london-edinburgh-dublin-trip-plan-54fa53a1f9c2e547640004ba,901,10 Days,"Trip to London, Edinburgh, Dublin"
https://www.triphobo.com/tripplans/united-kingdom-ireland-trip-from-jackson-hole-55e370a2a5e4d0282200030c,901,20 Days,"Trip to London, Edinburgh, Dublin, Inverness, Isle Of Skye"
https://www.triphobo.com/tripplans/edinburgh-itinerary-54461db4f9c2e5834a0009c4,892,5 Days,Best Of Five Days in Edinburgh
https://www.triphobo.com/tripplans/germany-netherlands-united-kingdom-trip-from-venice-54efec24fbc2e5237c000dcd,885,12 Days,"Trip to London, Munich, Edinburgh, Amsterdam"
https://www.triphobo.com/tripplans/london-trip-from-chennai-55b065edf3a73d9334001103,866,11 Days,Trip to London
https://www.triphobo.com/tripplans/europe-trip-from-delhi-5588118ffbc2e5f051000324,865,20 Days,"Trip to Berlin, London, Munich, Edinburgh, Glasgow, Dublin, Amsterdam, Dusseldorf"
https://www.triphobo.com/tripplans/edinburgh-trip-from-manchester-551e6f60e705453c3800003f,832,12 Days,Trip to Edinburgh
https://www.triphobo.com/tripplans/united-kingdom-ireland-trip-from-bangalore-55ae2f81ef616e470100008f,815,17 Days,"Trip to London, Edinburgh, Glasgow, Dublin, Manchester, Cardiff, Killarney"
https://www.triphobo.com/tripplans/united-kingdom-italy-greece-trip-plan-5529e1e9fbc2e5600c000a0a,808,20 Days,"Trip to Rome, Venice, Florence, Edinburgh, Milan, Athens, Santorini, Crete"
https://www.triphobo.com/tripplans/europe-trip-from-moscow-55a82459f3a73d4312000ace,807,18 Days,"Trip to Paris, Berlin, London, Moscow, Edinburgh, Brussels, Dublin, Amsterdam, Dresden"
https://www.triphobo.com/tripplans/united-kingdom-ireland-france-trip-plan-55595237fbc2e5d20a000722,799,17 Days,"Trip to Paris, London, Edinburgh, Dublin"
https://www.triphobo.com/tripplans/europe-trip-from-london-54f7f60e0c1d0a207200032d,771,16 Days,"Trip to Paris, Rome, Venice, London, Florence, Edinburgh, Milan, Vatican City"
https://www.triphobo.com/tripplans/spain-united-kingdom-ireland-trip-from-madrid-55d502d1a6e4d049040002c0,761,17 Days,"Trip to London, Edinburgh, Dublin, Barcelona, Manchester, Belfast, Cardiff"
https://www.triphobo.com/tripplans/europe-trip-from-bangalore-5569926ef9c2e5c33c0000c3,758,13 Days,"Trip to Paris, Rome, London, Edinburgh, Zurich, Frankfurt"
https://www.triphobo.com/tripplans/paris-london-edinburgh-trip-from-columbus-54ea77550c1d0af3590008ca,755,11 Days,"Trip to Paris, London, Edinburgh"
https://www.triphobo.com/tripplans/united-kingdom-france-italy-trip-plan-54f7ee7afbc2e5726b000642,747,16 Days,"Trip to Paris, Rome, Venice, London, Florence, Edinburgh, Milan"
https://www.triphobo.com/tripplans/paris-london-edinburgh-trip-from-columbus-54e94863f9c2e5c40a000001,741,11 Days,"Trip to Paris, London, Edinburgh"
https://www.triphobo.com/tripplans/europe-itinerary-from-albany-569144cd9bd33e440100026b,717,26 Days,"Trip to Rome, Edinburgh, Limerick, Monaco, Zurich, Barcelona, Copenhagen, Grindavik"
https://www.triphobo.com/tripplans/europe-trip-from-virginia-beach-55a660c04515a7c405000152,714,18 Days,"Trip to London, Florence, Edinburgh, Limerick, Bern, Amsterdam, Bath, Bamberg, La Spezia, Killarney"
https://www.triphobo.com/tripplans/united-kingdom-ireland-trip-from-tulsa-55be5ca419a23cd31100037c,706,14 Days,"Trip to London, Edinburgh, Dublin, Cambridge, York, Bath"
https://www.triphobo.com/tripplans/london-edinburgh-paris-trip-from-dubai-55681619fbc2e5734900146c,697,16 Days,"Trip to Paris, London, Edinburgh"
https://www.triphobo.com/tripplans/dublin-edinburgh-london-trip-from-portland-55348d5c0c1d0a981f000023,686,20 Days,"Trip to London, Edinburgh, Dublin"
https://www.triphobo.com/tripplans/paris-edinburgh-london-trip-from-paris-55ba487100fc94712c00152c,664,11 Days,"Trip to Paris, London, Edinburgh"
https://www.triphobo.com/tripplans/united-kingdom-france-ireland-itinerary-from-port-elizabeth-55f81434ec796fcd730001f3,661,30 Days,"Trip to Paris, London, Edinburgh, Dublin, Belfast, Liverpool"
https://www.triphobo.com/tripplans/europe-trip-from-bangalore-55c36fb919a23c81020000c1,659,10 Days,"Trip to Paris, Rome, Venice, Vienna, London, Munich, Edinburgh, Dublin, Amsterdam, Frankfurt"
https://www.triphobo.com/tripplans/edinburgh-malaga-trip-from-copenhagen-551b294efbc2e5b67400095c,652,15 Days,"Trip to Edinburgh, Malaga"
https://www.triphobo.com/tripplans/united-kingdom-itinerary-from-delhi-55fd1aff8527a50d290003b1,652,15 Days,"Trip to London, Leeds, Edinburgh, Manchester, Bath, Exeter, Liverpool, Aberdeen, Plymouth, Isle Of Skye"
https://www.triphobo.com/tripplans/edinburgh-london-paris-trip-plan-55402416fbc2e5893000040f,648,20 Days,"Trip to Paris, London, Edinburgh"
https://www.triphobo.com/tripplans/united-kingdom-trip-from-singapore-55d2f0826446cbe5050002ee,632,17 Days,"Trip to London, Edinburgh, Manchester, York"
https://www.triphobo.com/tripplans/paris-london-edinburgh-trip-plan-54ea7871f9c2e580360005d7,631,8 Days,"Trip to Paris, London, Edinburgh"
https://www.triphobo.com/tripplans/united-kingdom-itinerary-55ff15fa904719b37e000695,627,31 Days,"Trip to London, Edinburgh, Cambridge, York, Bath, Canterbury, Nottingham, Liverpool, Birmingham, Plymouth"
https://www.triphobo.com/tripplans/europe-itinerary-from-rome-560219bddb6928814000097b,625,27 Days,"Trip to Paris, Vienna, London, Edinburgh, Como, Konstanz, Siena"
https://www.triphobo.com/tripplans/europe-itinerary-from-rome-564289b59bd33e6b38000172,616,33 Days,"Trip to Paris, Vienna, London, Florence, Edinburgh, Lucca, Konstanz, Sorrento"
https://www.triphobo.com/tripplans/europe-itinerary-from-new-york-city-5655df85c3756e3306000018,616,29 Days,"Trip to Paris, Berlin, Rome, London, Edinburgh, Athens, Amsterdam, Prague, Krakow, Budapest"
https://www.triphobo.com/tripplans/spain-united-kingdom-trip-from-madrid-55d5042da5e4d0ce32000157,604,14 Days,"Trip to London, Edinburgh, Barcelona, Cardiff"
https://www.triphobo.com/tripplans/united-kingdom-trip-from-singapore-55dc6269769e4c017b00003c,602,10 Days,"Trip to London, Edinburgh, Manchester, Cambridge, York, Bath, Oxford, Nottingham, Belfast, Birmingham"
https://www.triphobo.com/tripplans/france-united-kingdom-ireland-trip-from-singapore-554278dffac2e52e310004ba,594,17 Days,Euro-love.
https://www.triphobo.com/tripplans/united-kingdom-ireland-france-trip-from-saskatoon-55c0297e1aa23c4a38000403,568,19 Days,"Trip to Paris, London, Edinburgh, Nice, Cork, Dublin, Kilkenny, Bayeux"
https://www.triphobo.com/tripplans/united-kingdom-belgium-france-trip-from-osnabr-ck-551008f0f9c2e50e71000318,562,9 Days,"Trip to Paris, London, Edinburgh, Brussels"
https://www.triphobo.com/tripplans/europe-itinerary-5602184dec796f0252000815,561,21 Days,"Trip to Paris, Berlin, Rome, Venice, London, Florence, Edinburgh, Milan, Amsterdam, Warsaw"
https://www.triphobo.com/tripplans/edinburgh-glasgow-london-itinerary-531737d9f9c2e5982b000007,552,3 Days,"Trip to Edinburgh, Glasgow, London"
https://www.triphobo.com/tripplans/edinburgh-london-paris-trip-from-chicago-559be128f9c2e54d6b000609,540,12 Days,"Trip to Paris, London, Edinburgh"
https://www.triphobo.com/tripplans/edinburgh-london-paris-trip-from-halifax-55ada60700fc948b5c000ed7,540,9 Days,"Trip to Paris, London, Edinburgh"
https://www.triphobo.com/tripplans/europe-itinerary-from-madrid-56035d8f4e7a6f7606000528,528,28 Days,"Trip to Paris, Berlin, London, Edinburgh, Dublin, Amsterdam, Prague, Budapest"
https://www.triphobo.com/tripplans/europe-itinerary-from-perth-5699e0778527a5322c0003a6,518,32 Days,"Trip to Paris, Berlin, Rome, Venice, London, Edinburgh, Athens, Dublin, Amsterdam, Prague"
https://www.triphobo.com/tripplans/united-kingdom-trip-from-washington-d-c-55dc8a8500fc94b76b0001f2,515,9 Days,"Trip to Edinburgh, Glasgow, Inverness, Dunvegan, Kilmuir"
https://www.triphobo.com/tripplans/london/itinerary-from-istanbul-567fe596a6d46d9712000537,514,10 Days,Trip to London
https://www.triphobo.com/tripplans/united-kingdom-ireland-trip-from-sydney-551e31a2fbc2e5dc73000185,506,20 Days,"Trip to London, Edinburgh, Dublin, Cardiff"
https://www.triphobo.com/tripplans/iceland-united-kingdom-ireland-itinerary-from-new-york-city-5642243ea6d46d314e00012a,505,33 Days,"Trip to London, Edinburgh, Glasgow, Galway, Dublin, Reykjavik, Belfast, Newcastle Upon Tyne, Cardiff, Dingle"
https://www.triphobo.com/tripplans/london-edinburgh-bath-trip-plan-529c31db61626364652ff800,504,3 Days,"Trip to London, Edinburgh, Bath"
https://www.triphobo.com/tripplans/europe-trip-from-san-francisco-55e252a2f3a73d3679000292,489,20 Days,"Trip to Paris, Venice, London, Edinburgh, Glasgow, Milan, Brussels, Dublin, Bern, Cardiff"
https://www.triphobo.com/tripplans/europe-itinerary-from-sydney-568f3a4885e482f959000042,489,42 Days,"Trip to Paris, London, Edinburgh, Barcelona, Granada, Madrid, Amsterdam, San Sebastian, Cordoba"
https://www.triphobo.com/tripplans/europe-trip-from-phoenix-55b1d45100fc94cb5b000081,486,20 Days,"Trip to Berlin, London, Edinburgh, Brussels, Dublin, Amsterdam"
https://www.triphobo.com/tripplans/copenhagen-edinburgh-heidelberg-itinerary-from-sydney-5648333a9bd33e24230000ef,479,35 Days,"Trip to Edinburgh, Heidelberg, Copenhagen"
https://www.triphobo.com/tripplans/london-edinburgh-bath-trip-plan-531161e2613fa800010a0000,473,3 Days,"Trip to London, Edinburgh, Bath"
https://www.triphobo.com/tripplans/united-kingdom-france-trip-from-charlotte-5570984af9c2e564060006df,469,10 Days,"Trip to Paris, London, Edinburgh, Bath, Cardiff"
https://www.triphobo.com/tripplans/edinburgh-london-itinerary-5294d454e705457e1e000000,454,2 Days,Trip to edinburgh london
https://www.triphobo.com/tripplans/london-edinburgh-bath-trip-plan-52cf130e6162636465666768,448,3 Days,"Trip to London, Edinburgh, Bath"
https://www.triphobo.com/tripplans/europe-itinerary-5635b7613216f5bc70000330,442,32 Days,"Trip to Paris, London, Edinburgh, Dublin, Amsterdam"
https://www.triphobo.com/tripplans/edinburgh/itinerary-from-philadelphia-56a87c49754719af25000515,441,11 Days,Trip to Edinburgh
https://www.triphobo.com/tripplans/london-edinburgh-trip-plan-546532e561626364650def00,439,4 Days,"Trip to London, Edinburgh"
https://www.triphobo.com/tripplans/europe-itinerary-from-edinburgh-561afa028427a56647000ddc,439,29 Days,"Trip to Rome, London, Brussels, Athens, Barcelona, Amsterdam"
https://www.triphobo.com/tripplans/europe-trip-from-singapore-55c216991aa23c29750000c0,438,20 Days,"Trip to Paris, London, Edinburgh, Brussels, Zurich, Amsterdam"
https://www.triphobo.com/tripplans/france-united-kingdom-italy-trip-from-bangalore-55902056fbc2e5c44300056e,435,10 Days,"Trip to Paris, Venice, London, Florence"
https://www.triphobo.com/tripplans/europe-itinerary-from-new-york-city-5627ca058427a51b2400059f,431,25 Days,"Trip to Paris, Berlin, Vienna, London, Munich, Edinburgh, Brussels, Amsterdam, Prague, Krakow"
https://www.triphobo.com/tripplans/london-llandudno-edinburgh-trip-from-london-55113835e705455b4000005e,430,12 Days,"Trip to London, Edinburgh, Llandudno"
https://www.triphobo.com/tripplans/united-kingdom-ireland-trip-from-sydney-551e3108fbc2e5870300015c,419,20 Days,"Trip to London, Edinburgh, Dublin, Cardiff"
https://www.triphobo.com/tripplans/europe-trip-from-london-555ef50ff9c2e58219000021,418,10 Days,"Trip to Paris, Edinburgh, Brussels, Zurich"
https://www.triphobo.com/tripplans/dublin-edinburgh-amsterdam-trip-from-boston-553534c2e70545360e00015a,415,13 Days,"Trip to Edinburgh, Dublin, Amsterdam"
https://www.triphobo.com/tripplans/europe-trip-from-ottawa-55b6ff0219a23cac080003cc,413,20 Days,"Trip to Vienna, Munich, Edinburgh, Dublin, Amsterdam, Prague"
https://www.triphobo.com/tripplans/united-kingdom-trip-plan-55b9ceda531f71dd2f000613,412,10 Days,"Trip to London, Edinburgh, Manchester, Cambridge, Oxford, Birmingham, Cardiff"
https://www.triphobo.com/tripplans/edinburgh-london-mumbai-trip-from-mumbai-551ec7b9fbc2e5260800039a,409,11 Days,"Trip to Mumbai, London, Edinburgh"
https://www.triphobo.com/tripplans/london-trip-from-mumbai-552e133ee70545995d00073d,406,12 Days,Trip to London
https://www.triphobo.com/tripplans/inverness-edinburgh-trip-from-saint-louis-55e898ca39163c6f050000b6,403,19 Days,"Trip to Edinburgh, Inverness"
https://www.triphobo.com/tripplans/united-kingdom-france-italy-trip-from-glasgow-5531dc33fbc2e5ad33000ad7,401,17 Days,"Trip to Paris, Rome, Venice, London, Edinburgh"
https://www.triphobo.com/tripplans/europe-itinerary-from-spokane-561d50c93216f5db2d00156a,400,32 Days,"Trip to Berlin, Rome, London, Munich, Edinburgh, Amsterdam, Manchester, Reykjavik, Cologne, Oxford"
https://www.triphobo.com/tripplans/europe-itinerary-from-denver-563649e85d31b98322000695,399,32 Days,"Trip to Paris, London, Edinburgh, Nice, Strasbourg, Brussels, Amsterdam, Nancy, Cornwall"
https://www.triphobo.com/tripplans/united-kingdom-france-italy-trip-from-glasgow-5531dcf9f9c2e5044800018f,395,18 Days,"Trip to Paris, Rome, Venice, London, Edinburgh"
https://www.triphobo.com/tripplans/london-edinburgh-bath-trip-plan-544268646162636465666768,394,3 Days,"Trip to London, Edinburgh, Bath"
https://www.triphobo.com/tripplans/cambridge-oxford-edinburgh-trip-from-london-54f8aafef9c2e5d7540002fc,394,3 Days,"Trip to Edinburgh, Cambridge, Oxford"
https://www.triphobo.com/tripplans/edinburgh-itinerary-52fe2bf1e70545c25e000001,391,1 Day,Trip to Edinburgh
https://www.triphobo.com/tripplans/london-edinburgh-trip-plan-544256816162636465666768,385,3 Days,"Trip to London, Edinburgh"
https://www.triphobo.com/tripplans/europe-trip-from-adelaide-55b977c300fc94075d000505,385,20 Days,"Trip to Paris, Rome, London, Edinburgh, Madrid, Frankfurt"
https://www.triphobo.com/tripplans/europe-itinerary-from-new-york-city-563979229bd33e862000058b,382,22 Days,"Trip to Paris, London, Florence, Edinburgh, Dublin, Amsterdam, Marseille, Ennis"
https://www.triphobo.com/tripplans/europe-itinerary-from-boston-563dfc548527a5f4070004a5,382,16 Days,"Trip to Paris, Florence, Edinburgh, Amsterdam, Oslo, Cartagena, Brienz"
https://www.triphobo.com/tripplans/dublin-edinburgh-london-itinerary-from-boston-5701229a0fe5d0a4100015b7,378,16 Days,"Trip to London, Edinburgh, Dublin"
https://www.triphobo.com/tripplans/europe-itinerary-56005b4d904719962f000ce2,369,14 Days,"Trip to Edinburgh, Galway, Limerick, Helsinki, Turku, Stavanger, Isle Of Skye"
https://www.triphobo.com/tripplans/edinburgh-itinerary-54461b75f9c2e5e364000f98,367,4 Days,Four  Days in Edinburgh
https://www.triphobo.com/tripplans/united-kingdom-france-germany-itinerary-from-los-angeles-5609add0bd45cb597b000393,367,32 Days,"Trip to Paris, London, Edinburgh, Leipzig"
https://www.triphobo.com/tripplans/edinburgh-trip-from-marseille-54ee3490fbc2e55732000925,365,5 Days,Trip to Edinburgh
https://www.triphobo.com/tripplans/united-kingdom-ireland-trip-from-mumbai-554472acfbc2e50838000799,360,15 Days,"Trip to London, Edinburgh, Dublin, Cardiff"
https://www.triphobo.com/tripplans/europe-itinerary-from-rome-56b18f02b96928320f0009c4,358,21 Days,"Trip to Rome, Edinburgh, Lyon, Milan, Brussels, Pisa, Amsterdam, Inverness, Bordeaux, Tours"
https://www.triphobo.com/tripplans/united-kingdom-france-italy-trip-from-glasgow-5531dbf9fbc2e5e532000ab1,356,16 Days,"Trip to Paris, Rome, Venice, London, Edinburgh"
https://www.triphobo.com/tripplans/edinburgh-london-paris-trip-from-halifax-55ada6c1ef616e2d6d000441,355,10 Days,"Trip to Paris, London, Edinburgh"
https://www.triphobo.com/tripplans/europe-trip-from-london-558cfdfcfbc2e55d2f0000e6,349,16 Days,"Trip to Paris, Rome, Venice, London, Florence, Edinburgh, Milan, Vatican City"
https://www.triphobo.com/tripplans/edinburgh-inverness-trip-from-london-55e748ad6446cb260f00093e,349,5 Days,"Trip to Edinburgh, Inverness"
https://www.triphobo.com/tripplans/united-kingdom-trip-from-delhi-55842951fac2e5a748000450,348,7 Days,"Trip to London, Edinburgh, York, Oxford, Sheffield, Cardiff"
https://www.triphobo.com/tripplans/dublin-edinburgh-london-trip-plan-548ba606fbc2e5502e000c47,346,4 Days,Meg and Liv's Eurotrip
https://www.triphobo.com/tripplans/united-kingdom-trip-from-mumbai-552137f2fbc2e5f96900025f,345,19 Days,"Trip to London, Edinburgh, York, Cardiff"
https://www.triphobo.com/tripplans/edinburgh-trip-plan-550ad50cfbc2e5965d0000e0,344,6 Days,Trip to Edinburgh
https://www.triphobo.com/tripplans/bath-oxford-trip-from-london-5582836afbc2e5503700134d,344,9 Days,"Trip to Bath, Oxford"
https://www.triphobo.com/tripplans/europe-trip-from-edinburgh-558a77dffbc2e5034d000057,343,11 Days,"Trip to Rome, Edinburgh, Milan, Athens, Barcelona, Madrid, Oslo, Thessaloniki, Copenhagen"
https://www.triphobo.com/tripplans/united-kingdom-itinerary-from-delhi-5609dc188527a53e06000508,341,19 Days,"Trip to London, Edinburgh, Glasgow, Glendale"
https://www.triphobo.com/tripplans/europe-itinerary-from-london-561add128527a52057000856,337,23 Days,"Trip to Paris, Berlin, Munich, Edinburgh, Strasbourg, Brussels, Dublin, Zurich, Calais, Plymouth"
https://www.triphobo.com/tripplans/london/itinerary-from-portland-563804093216f5641f000588,337,31 Days,Trip to London
https://www.triphobo.com/tripplans/ireland-united-kingdom-trip-from-shannon-5567fbc1fac2e5883e000a7d,334,14 Days,"Trip to London, Edinburgh, Galway, Dublin, York"
https://www.triphobo.com/tripplans/united-kingdom-france-netherlands-trip-from-bangalore-557dbfe5f9c2e55457000688,334,15 Days,"Trip to Paris, London, Cannes, Edinburgh, Nice, Amsterdam, Manchester, Cambridge, Birmingham"
https://www.triphobo.com/tripplans/europe-itinerary-from-albuquerque-5605b0368bd56dfd6e000436,334,15 Days,"Trip to Paris, London, Edinburgh, Brussels, Amsterdam, Manchester, Belfast"
https://www.triphobo.com/tripplans/edinburgh-trip-from-edinburgh-55199874e7054552330002f9,328,8 Days,Trip to Edinburgh
https://www.triphobo.com/tripplans/europe-itinerary-from-new-york-city-55ff310b9ffc94e605000018,328,42 Days,"Trip to Paris, Venice, Edinburgh, Dublin, Zurich, Valencia, Amsterdam, Oslo, Reykjavik, Santorini"
https://www.triphobo.com/tripplans/dublin-edinburgh-london-itinerary-from-boston-570138978527a5e67c000850,325,16 Days,"Trip to London, Edinburgh, Dublin"
https://www.triphobo.com/tripplans/united-kingdom-france-ireland-itinerary-from-port-elizabeth-55f81299db69285f6b0005de,323,23 Days,"Trip to Paris, London, Edinburgh, Dublin, Belfast, Liverpool"
https://www.triphobo.com/tripplans/ireland-united-kingdom-united-states-trip-from-los-angeles-555935c5f9c2e575440005e4,321,12 Days,"Trip to London, Los Angeles, Edinburgh, Dublin"
https://www.triphobo.com/tripplans/europe-itinerary-from-new-york-city-5627a1c80e3307d2010003eb,320,22 Days,"Trip to Paris, Berlin, Vienna, London, Munich, Edinburgh, Glasgow, Brussels, Amsterdam, Prague"
https://www.triphobo.com/tripplans/edinburgh-london-itinerary-5294d452e705454a1f000000,318,2 Days,Trip to edinburgh london
https://www.triphobo.com/tripplans/europe-itinerary-from-new-york-city-568492d49bd33e09200004c7,317,29 Days,"Trip to Paris, Berlin, Rome, London, Edinburgh, Athens, Amsterdam, Prague, Krakow, Budapest"
https://www.triphobo.com/tripplans/dublin-edinburgh-london-itinerary-from-phoenix-56b68ac1c8ed6eee050002d7,312,12 Days,"Trip to London, Edinburgh, Dublin"
https://www.triphobo.com/tripplans/united-kingdom-ireland-itinerary-55fe111b8427a51c4a000156,310,13 Days,"Trip to London, Edinburgh, Dublin, Belfast, Isle Of Skye"
https://www.triphobo.com/tripplans/edinburgh-florence-paris-itinerary-from-manila-56c44a718e4719992300031a,306,25 Days,"Trip to Paris, Florence, Edinburgh"
https://www.triphobo.com/tripplans/europe-itinerary-from-houston-5645d11e8e1f71011200032f,302,12 Days,"Trip to Paris, Rome, Venice, London, Edinburgh, Brussels, Athens, Dublin, Barcelona, Manchester"
https://www.triphobo.com/tripplans/europe-itinerary-from-brisbane-564d803085e4822e710006a7,299,48 Days,"Trip to Paris, Rome, London, Edinburgh, Dublin, Madrid, Amsterdam, Copenhagen, Santorini, Hvar"
https://www.triphobo.com/tripplans/united-kingdom-itinerary-from-burwood-east-56b1dc3e8f4719372d00044d,299,15 Days,"Trip to Edinburgh, Glasgow, Aberdeen, Inverness, Glendale"
https://www.triphobo.com/tripplans/france-united-kingdom-trip-from-huntsville-55f057a51c97dc78580002b0,296,12 Days,"Trip to Paris, London, Edinburgh, Inverness"
https://www.triphobo.com/tripplans/glasgow-edinburgh-portree-trip-from-chennai-55e08bee900670f1770003ed,294,8 Days,"Trip to Edinburgh, Glasgow, Portree"
https://www.triphobo.com/tripplans/united-kingdom-france-trip-from-chennai-557bc9abf9c2e59659000cd7,292,10 Days,"Trip to Paris, London, Edinburgh, Glasgow, Manchester"
https://www.triphobo.com/tripplans/edinburgh-itinerary-5444f88ce705453465000137,291,3 Days,Three Days Iconic Itinerary for Edinburgh
https://www.triphobo.com/tripplans/london-edinburgh-manchester-trip-plan-55265c570c1d0a4d3b00014c,289,6 Days,"Trip to London, Edinburgh, Manchester"
https://www.triphobo.com/tripplans/edinburgh-itinerary-535ebb2ae70545a453000010,285,2 Days,Trip to Edinburgh
https://www.triphobo.com/tripplans/london-edinburgh-bath-trip-plan-547dc8ae6162636465666768,285,4 Days,"Trip to London, Edinburgh, Bath"
https://www.triphobo.com/tripplans/edinburgh-trip-from-malta-55199620f9c2e51321000080,284,8 Days,Trip to Edinburgh
https://www.triphobo.com/tripplans/united-kingdom-trip-from-mumbai-55e9710c1c97dcf718000081,282,7 Days,"Trip to London, Edinburgh, Bristol, Southampton, Isle Of Skye"
