url,views,days,name
https://www.triphobo.com/tripplans/australia-new-zealand-trip-from-salt-lake-city-55b91c3b1aa23c520a000f29,1880,20 Days,"20 Day Trip to Australia, New Zealand from Salt Lake City"
https://www.triphobo.com/tripplans/asia-oceania-europe-itinerary-from-toronto-567730d38427a5b1300000dd,1870,34 Days,"Trip to Paris, Sydney, Kuala Lumpur, Munich, Beijing, Auckland, Dubai"
https://www.triphobo.com/tripplans/sydney-cairns-uluru-trip-from-los-angeles-55010010fbc2e5e72e000976,1518,15 Days,"Trip to Sydney, Cairns, Uluru"
https://www.triphobo.com/tripplans/europe-oceania-trip-from-sydney-55558cedf9c2e5497d000cfc,1514,20 Days,"Trip to Paris, Rome, Vienna, London, Sydney, Athens, Dublin, Dusseldorf, Copenhagen, Warsaw"
https://www.triphobo.com/tripplans/australia-new-zealand-trip-from-kolkata-55754715fbc2e5672c0004e3,1471,18 Days,"18 Day Trip to Australia, New Zealand from Kolkata"
https://www.triphobo.com/tripplans/europe-oceania-trip-from-sydney-5553ca87fac2e57058000930,1377,20 Days,"Trip to Paris, Rome, Venice, London, Sydney, Munich, Milan, Barcelona, Prague, Lisbon"
https://www.triphobo.com/tripplans/africa-asia-oceania-itinerary-from-athens-568ad3f969ab715757000aec,1252,30 Days,"Trip to Singapore, Tokyo, Agra, Cairo, Nairobi, Perth, Sydney, Kuala Lumpur, Dubai, Devonport"
https://www.triphobo.com/tripplans/australia-hong-kong-trip-from-mumbai-5588fab7fac2e5986b0004b3,1220,16 Days,"Trip to Sydney, Cairns, Brisbane, Alice Springs, Hong Kong"
https://www.triphobo.com/tripplans/sydney-2-day-tour,1157,2 Days,Sydney 2 Day Tour
https://www.triphobo.com/tripplans/australia-new-zealand-fiji-trip-from-delhi-55862b5dfac2e54f04000da9,1097,14 Days,"Trip to Sydney, Cairns, Queenstown, Rotorua, Auckland, Coffs Harbour, Rockhampton, Suva, Nadi"
https://www.triphobo.com/tripplans/australia-trip-from-london-55d86d31f3a73d42780006ab,1095,16 Days,"Trip to Melbourne, Perth, Sydney, Hamilton Island"
https://www.triphobo.com/tripplans/sydney/itinerary-from-san-francisco-56bcc0478e01e3e30a000001,985,24 Days,Trip to Sydney
https://www.triphobo.com/tripplans/australia-new-zealand-india-trip-from-mumbai-55bb7a7800fc94470800037d,972,14 Days,"Trip to Mumbai, Melbourne, Sydney, Brisbane, Queenstown, Rotorua, Auckland, Christchurch"
https://www.triphobo.com/tripplans/europe-asia-oceania-trip-from-san-jose-55a91ada00fc946d300006b4,959,15 Days,"Trip to Paris, Venice, Vienna, London, Bangkok, Sydney, Munich, Lisbon, Dubai, Santorini"
https://www.triphobo.com/tripplans/australia-new-zealand-trip-from-los-angeles-55175d10fbc2e5e364000b87,903,7 Days,"Trip to Melbourne, Perth, Sydney, Brisbane, Queenstown, Auckland, Christchurch"
https://www.triphobo.com/tripplans/world-tour-trip-from-chicago-55d113f5a5e4d00e350000e3,899,20 Days,"Trip to Tokyo, Venice, Cairo, Delhi, Sydney, Beijing, Auckland, Dubai"
https://www.triphobo.com/tripplans/australia-new-zealand-trip-from-delhi-55e3ff8d60acdc5d05000019,897,16 Days,"Trip to Melbourne, Sydney, Queenstown, Rotorua, Christchurch, Gold Coast, Hamilton Island"
https://www.triphobo.com/tripplans/europe-oceania-trip-from-sydney-5524b4ea0c1d0a0b0d000115,886,16 Days,"Trip to Rome, Vienna, Sydney, Dubrovnik"
https://www.triphobo.com/tripplans/australia-itinerary-from-mumbai-568c033385e48244480011bd,856,13 Days,"Trip to Melbourne, Sydney, Cairns, Brisbane, Gold Coast, Hervey Bay, Surfers Paradise"
https://www.triphobo.com/tripplans/australia-itinerary-from-mumbai-567295928427a5bd02000adf,712,12 Days,"Trip to Melbourne, Adelaide, Sydney, Brisbane, Gold Coast, Newcastle"
https://www.triphobo.com/tripplans/sydney/itinerary-from-madison-5690971e9bd33e4a6a000b0e,685,32 Days,Trip to Sydney
https://www.triphobo.com/tripplans/australia-new-zealand-itinerary-from-delhi-567652ec85e482226c000321,675,11 Days,"Trip to Sydney, Queenstown, Auckland, Gold Coast"
https://www.triphobo.com/tripplans/new-zealand-australia-itinerary-from-delhi-568d4eb99bd33e651a0000e4,664,15 Days,"Trip to Sydney, Brisbane, Auckland, Wellington"
https://www.triphobo.com/tripplans/australia-new-zealand-itinerary-from-san-francisco-569581a79bd33e4a52000dcc,648,16 Days,"Trip to Melbourne, Sydney, Cairns, Queenstown, Auckland"
https://www.triphobo.com/tripplans/sydney-hobart-trip-plan-54982be96162636465666768,645,4 Days,"Trip to Sydney, Hobart"
https://www.triphobo.com/tripplans/world-tour-trip-from-jakarta-558d3a95fac2e57c610003ee,636,10 Days,"Trip to Singapore, London, Los Angeles, Melbourne, Perth, Sydney, Kuala Lumpur, Hong Kong, Byron Bay, Bali"
https://www.triphobo.com/tripplans/asia-europe-oceania-trip-from-sydney-55595eb3fac2e5e458000a97,614,20 Days,"Trip to Singapore, Sydney, Athens, Istanbul, Dubai, Frankfurt"
https://www.triphobo.com/tripplans/australia-itinerary-from-abu-dhabi-569397a9b7853a0010000468,603,10 Days,"Trip to Melbourne, Adelaide, Perth, Sydney, Geelong, Gold Coast, Hervey Bay, Surfers Paradise, Exmouth, Byron Bay"
https://www.triphobo.com/tripplans/australia-itinerary-from-ahmedabad-568a46eaea15f5da0d000172,600,15 Days,"Trip to Sydney, Brisbane, Gold Coast, Hamilton Island"
https://www.triphobo.com/tripplans/cairns-brisbane-sydney-trip-from-singapore-555ca08ef9c2e5d22e00015c,591,11 Days,"Trip to Sydney, Cairns, Brisbane"
https://www.triphobo.com/tripplans/sydney-hobart-trip-plan-542da04f61620f1f0000ef00,575,4 Days,"Trip to Sydney, Hobart"
https://www.triphobo.com/tripplans/australia-itinerary-from-sydney-568ceedd8527a58a450007e1,572,11 Days,"Trip to Sydney, Cairns, Gold Coast, Uluru"
https://www.triphobo.com/tripplans/australia-new-zealand-trip-from-gold-coast-558ff51efbc2e546430002ff,566,13 Days,"Trip to Sydney, Cairns, Queenstown, Rotorua, Auckland, Christchurch"
https://www.triphobo.com/tripplans/sydney-hobart-trip-plan-544623046162637bb700002e,550,4 Days,"Trip to Sydney, Hobart"
https://www.triphobo.com/tripplans/new-zealand-australia-itinerary-from-san-francisco-56959add85e482b9080002b2,527,15 Days,"Trip to Melbourne, Sydney, Cairns, Queenstown, Rotorua, Auckland, Christchurch"
https://www.triphobo.com/tripplans/melbourne-sydney-itinerary-from-kuala-lumpur-568b001569ab717e5a000e60,522,14 Days,"Trip to Melbourne, Sydney"
https://www.triphobo.com/tripplans/australia-new-zealand-itinerary-from-delhi-568cb47b69ab71d80f0005ac,519,10 Days,"Trip to Melbourne, Sydney, Auckland, Christchurch"
https://www.triphobo.com/tripplans/sydney-hobart-trip-plan-542d4e086162636465666768,512,3 Days,"Trip to Sydney, Hobart"
https://www.triphobo.com/tripplans/australia-trip-from-new-york-city-55649be6fbc2e55648000772,506,12 Days,"Trip to Adelaide, Sydney, Cairns, Airlie Beach, Uluru"
https://www.triphobo.com/tripplans/sydney-lautoka-bali-itinerary-56991b0e69ab718d5e00012e,503,15 Days,"Trip to Sydney, Lautoka, Bali"
https://www.triphobo.com/tripplans/sydney/itinerary-from-bangalore-56b6cb079047198639000033,502,10 Days,Trip to Sydney
https://www.triphobo.com/tripplans/sydney-bangkok-itinerary-from-calgary-5696890d85e482b47900033a,498,13 Days,"Trip to Bangkok, Sydney"
https://www.triphobo.com/tripplans/australia-new-zealand-trip-from-delhi-55bf91c1f3a73d32370002ef,494,14 Days,"Trip to Melbourne, Sydney, Brisbane, Queenstown, Rotorua, Auckland, Christchurch, Byron Bay"
https://www.triphobo.com/tripplans/australia-itinerary-from-mumbai-56762a198527a5c36c000044,493,8 Days,"Trip to Melbourne, Sydney, Gold Coast, Canberra, Byron Bay"
https://www.triphobo.com/tripplans/sydney-gold-coast-cairns-itinerary-from-london-5622a0b886ccbe8b250003d3,482,21 Days,"Trip to Sydney, Cairns, Gold Coast"
https://www.triphobo.com/tripplans/sydney-hobart-trip-plan-543d4dfa6162636465666768,478,4 Days,"Trip to Sydney, Hobart"
https://www.triphobo.com/tripplans/australia-itinerary-from-singapore-56c546338646cb270600004c,476,12 Days,"Trip to Melbourne, Sydney, Gold Coast, Canberra, Surfers Paradise, Wollongong"
https://www.triphobo.com/tripplans/sydney/itinerary-from-south-bend-56992cd58427a5dd48000dd1,469,11 Days,Trip to Sydney
https://www.triphobo.com/tripplans/sydney-hobart-trip-plan-547de7bc6162636465666768,462,4 Days,"Trip to Sydney, Hobart"
https://www.triphobo.com/tripplans/sydney/itinerary-from-goa-velha-56a8993c8e4719c0090005f8,461,11 Days,Trip to Sydney
https://www.triphobo.com/tripplans/australia-new-zealand-trip-from-delhi-55f1975e329370d40500001a,457,16 Days,"Trip to Sydney, Cairns, Queenstown, Rotorua, Auckland, Christchurch, Gold Coast"
https://www.triphobo.com/tripplans/sydney-melbourne-perth-itinerary-569750aa8527a56562000181,457,27 Days,"Trip to Melbourne, Perth, Sydney"
https://www.triphobo.com/tripplans/sydney-hobart-trip-plan-529b3b84616263642ff80000,450,4 Days,"Trip to Sydney, Hobart"
https://www.triphobo.com/tripplans/australia-itinerary-from-delhi-567d84278427a58318000d48,448,8 Days,"Trip to Melbourne, Adelaide, Sydney, Gold Coast"
https://www.triphobo.com/tripplans/australia-itinerary-from-brisbane-563eb00d8a46cb915a0007a4,447,21 Days,"Trip to Melbourne, Adelaide, Sydney, Cairns, Daylesford, Canberra"
https://www.triphobo.com/tripplans/london-warsaw-sydney-trip-plan-55392927f9c2e5d61f0002fa,416,14 Days,"Trip to London, Sydney, Warsaw"
https://www.triphobo.com/tripplans/sydney-hervey-bay-newcastle-trip-from-morehead-559ffb8ffac2e52603000067,414,11 Days,"Trip to Sydney, Newcastle, Hervey Bay"
https://www.triphobo.com/tripplans/australia-itinerary-from-mumbai-56558cea85e4829c670000de,413,20 Days,"Trip to Melbourne, Adelaide, Perth, Sydney, Geelong, Gold Coast, Hervey Bay, Surfers Paradise, Exmouth, Byron Bay"
https://www.triphobo.com/tripplans/sydney-hobart-trip-plan-52f627cf616263204f0002ae,410,4 Days,"Trip to Sydney, Hobart"
https://www.triphobo.com/tripplans/auckland-sydney-itinerary-from-dubai-567d657285e4820766000d5c,407,7 Days,"Trip to Sydney, Auckland"
https://www.triphobo.com/tripplans/australia-itinerary-from-delhi-568c6c829bd33ea60d00070a,406,7 Days,"Trip to Melbourne, Perth, Sydney, Gold Coast"
https://www.triphobo.com/tripplans/asia-oceania-north-america-itinerary-from-warsaw-562cb9a08427a5663c0003ba,400,25 Days,"Trip to Los Angeles, Sydney, Shanghai, Auckland"
https://www.triphobo.com/tripplans/sydney-hobart-trip-plan-52c504606162636465666768,398,4 Days,"Trip to Sydney, Hobart"
https://www.triphobo.com/tripplans/sydney-hobart-trip-plan-5464671b6162636465666768,395,3 Days,"Trip to Sydney, Hobart"
https://www.triphobo.com/tripplans/sydney-auckland-itinerary-from-denver-5693d1f369ab718f10000673,394,10 Days,"Trip to Sydney, Auckland"
https://www.triphobo.com/tripplans/sydney-1-day-itinerary,392,1 Day,Best of Harbour City
https://www.triphobo.com/tripplans/australia-itinerary-56940c2485e4820435000cab,392,15 Days,"Trip to Sydney, Cairns, Brisbane, Gold Coast, Byron Bay"
https://www.triphobo.com/tripplans/melbourne-brisbane-sydney-itinerary-from-bangalore-56a879d5b86928351800064a,392,8 Days,"Trip to Melbourne, Sydney, Brisbane"
https://www.triphobo.com/tripplans/sydney-melbourne-perth-itinerary-from-mumbai-56957709a6d46dd754000127,391,10 Days,"Trip to Melbourne, Perth, Sydney"
https://www.triphobo.com/tripplans/australia-new-zealand-indonesia-trip-from-okinawa-55b0b9ac00fc94a439000658,387,14 Days,"Trip to Melbourne, Sydney, Auckland, Bali"
https://www.triphobo.com/tripplans/asia-europe-oceania-trip-from-sydney-552b98440c1d0a372f0001b1,378,20 Days,"Trip to Paris, Singapore, Bangkok, Sydney, Munich, Brussels, Amsterdam, Prague, Dubrovnik, Budapest"
https://www.triphobo.com/tripplans/australia-itinerary-5603d4764e7a6f2863000462,375,16 Days,"Trip to Melbourne, Adelaide, Perth, Sydney, Geelong, Gold Coast, Newcastle, Hervey Bay, Surfers Paradise"
https://www.triphobo.com/tripplans/australia-new-zealand-itinerary-from-new-zealand-56792a468a46cb780e0004e2,375,25 Days,"Trip to Melbourne, Adelaide, Perth, Sydney, Queenstown, Auckland, Christchurch, Wellington, Rockhampton, Exmouth"
https://www.triphobo.com/tripplans/sydney/itinerary-from-gold-coast-56ac032db86928053d0000d0,373,8 Days,Trip to Sydney
https://www.triphobo.com/tripplans/sydney-hobart-trip-plan-54daa6836162636465666768,372,4 Days,"Trip to Sydney, Hobart"
https://www.triphobo.com/tripplans/sydney-melbourne-perth-itinerary-from-sydney-56a6f4f3b86928180c000b44,359,22 Days,"Trip to Melbourne, Perth, Sydney"
https://www.triphobo.com/tripplans/australia-new-zealand-trip-from-delhi-55c3421af3a73d1410000095,357,11 Days,"Trip to Melbourne, Sydney, Brisbane, Queenstown, Auckland, Christchurch"
https://www.triphobo.com/tripplans/oceania-asia-europe-itinerary-569c69050f2f072a06000034,356,33 Days,"Trip to Tokyo, Taipei, London, Bangkok, Sydney"
https://www.triphobo.com/tripplans/sydney-hobart-trip-plan-52ff50f16162636465666768,354,4 Days,"Trip to Sydney, Hobart"
https://www.triphobo.com/tripplans/sydney-trip-plan-55106d03fbc2e578780007bd,353,7 Days,Trip to Sydney
https://www.triphobo.com/tripplans/australia-itinerary-from-ahmedabad-56a087ccbdfc941f06000009,351,21 Days,"Trip to Melbourne, Adelaide, Sydney, Hobart, Gold Coast, Canberra, Surfers Paradise, Exmouth, Byron Bay, Fraser Island"
https://www.triphobo.com/tripplans/sydney/itinerary-from-amritsar-56c68995c8ed6e651e000513,345,12 Days,Trip to Sydney
https://www.triphobo.com/tripplans/phuket-sydney-new-york-city-trip-from-mumbai-553a435ff9c2e533470004e1,344,13 Days,"Trip to New York City, Sydney, Phuket"
https://www.triphobo.com/tripplans/australia-new-zealand-fiji-itinerary-from-kolkata-560fb4d78527a54d67000344,342,19 Days,"Trip to Melbourne, Sydney, Cairns, Brisbane, Queenstown, Rotorua, Auckland, Christchurch, Nadi"
https://www.triphobo.com/tripplans/sydney-melbourne-itinerary-from-kuala-lumpur-568e415669ab712c090004ed,337,8 Days,"Trip to Melbourne, Sydney"
https://www.triphobo.com/tripplans/sydney-brisbane-itinerary-from-johannesburg-567f8f828a46cbee0f0001fe,330,8 Days,"Trip to Sydney, Brisbane"
https://www.triphobo.com/tripplans/sydney/itinerary-from-mumbai-56a8c1898527a5db710007c1,330,9 Days,Trip to Sydney
https://www.triphobo.com/tripplans/australia-trip-from-chicago-558d6abefbc2e5584500064f,329,8 Days,"Trip to Sydney, Brisbane, Newcastle, Uluru"
https://www.triphobo.com/tripplans/melbourne-sydney-gold-coast-itinerary-from-hong-kong-567a48f38427a58c3d00037f,329,10 Days,"Trip to Melbourne, Sydney, Gold Coast"
https://www.triphobo.com/tripplans/sydney-itinerary-535139fbe70545e92a000006,327,2 Days,Trip to Sydney
https://www.triphobo.com/tripplans/oceania-europe-asia-itinerary-from-kitchener-56a5ac7bbc6928a30e00041e,322,55 Days,"Trip to Tokyo, Venice, London, Sydney, Istanbul, Auckland, Amsterdam, Reykjavik, Santorini, Bora Bora"
https://www.triphobo.com/tripplans/singapore-australia-trip-from-frankfurt-555c9f51fbc2e5ee5900020b,317,17 Days,"Trip to Singapore, Sydney, Cairns, Brisbane"
https://www.triphobo.com/tripplans/singapore-sydney-itinerary-from-delhi-5673e0d58527a52f04000925,309,11 Days,"Trip to Singapore, Sydney"
https://www.triphobo.com/tripplans/sydney/itinerary-from-caracas-5691386883823aa4120000d4,303,23 Days,Trip to Sydney
https://www.triphobo.com/tripplans/sydney-auckland-itinerary-from-nashville-56881d18a6d46d272f000256,302,11 Days,"Trip to Sydney, Auckland"
https://www.triphobo.com/tripplans/sydney-melbourne-itinerary-from-kuala-lumpur-568e41d08527a5824500025e,302,8 Days,"Trip to Melbourne, Sydney"
https://www.triphobo.com/tripplans/new-zealand-australia-itinerary-from-mumbai-56715fa1a6d46d7d3800085d,300,16 Days,"Trip to Sydney, Cairns, Queenstown, Rotorua, Auckland, Gold Coast, Dunedin"
https://www.triphobo.com/tripplans/australia-itinerary-from-london-5686f43185e4825e73000cde,299,13 Days,"Trip to Melbourne, Sydney, Brisbane, Gold Coast"
https://www.triphobo.com/tripplans/sydney-cairns-brisbane-trip-from-toronto-5580ed69fac2e5a345000619,297,12 Days,"Trip to Sydney, Cairns, Brisbane"
https://www.triphobo.com/tripplans/newcastle-sydney-hervey-bay-trip-plan-559fd2e3fac2e5626b0000a4,296,11 Days,"Trip to Sydney, Newcastle, Hervey Bay"
https://www.triphobo.com/tripplans/australia-new-zealand-itinerary-from-boston-568ea4a169ab716e0a0007f9,296,16 Days,"Trip to Melbourne, Sydney, Rotorua, Auckland"
https://www.triphobo.com/tripplans/sydney/itinerary-from-auckland-56b8fc448527a5711e0006b9,296,5 Days,Trip to Sydney
https://www.triphobo.com/tripplans/australia-new-zealand-itinerary-from-kolkata-56074bc2f7ca70fb03000227,294,15 Days,"Trip to Sydney, Cairns, Queenstown, Auckland, Christchurch, Gold Coast"
https://www.triphobo.com/tripplans/sydney-hobart-trip-plan-5325837f616263485f000212,292,4 Days,"Trip to Sydney, Hobart"
https://www.triphobo.com/tripplans/sydney-hobart-trip-plan-5445ea096162636465666768,291,3 Days,"Trip to Sydney, Hobart"
https://www.triphobo.com/tripplans/sydney/itinerary-from-dallas-56960cef69ab71755b000000,285,5 Days,Trip to Sydney
https://www.triphobo.com/tripplans/melbourne-gold-coast-sydney-itinerary-from-delhi-568573968427a5836400004b,284,9 Days,"Trip to Melbourne, Sydney, Gold Coast"
https://www.triphobo.com/tripplans/sydney/itinerary-from-philadelphia-56775b818527a5c061000684,281,29 Days,Trip to Sydney
https://www.triphobo.com/tripplans/europe-oceania-itinerary-56a406161acb70711800046d,279,42 Days,"Trip to Paris, Rome, London, Perth, Sydney, Bergen, Athens, Barcelona, Dubrovnik, Reykjavik"
https://www.triphobo.com/tripplans/sydney-gold-coast-itinerary-5671f06e85e482f6350004d6,278,7 Days,"Trip to Sydney, Gold Coast"
https://www.triphobo.com/tripplans/sydney-trip-from-singapore-550cec94fbc2e5836f0006d8,277,7 Days,Trip to Sydney
https://www.triphobo.com/tripplans/australia-itinerary-from-mumbai-5699f8a485e482f04d0006b5,277,11 Days,"Trip to Melbourne, Perth, Sydney, Gold Coast"
https://www.triphobo.com/tripplans/sydney-trip-from-hong-kong-551bfc51fbc2e52a2600035b,273,6 Days,Trip to Sydney
https://www.triphobo.com/tripplans/sydney-trip-from-singapore-5511879bfbc2e5aa2700044e,272,5 Days,Trip to Sydney
https://www.triphobo.com/tripplans/sydney-auckland-itinerary-from-nashville-56881c518427a5f65f000491,271,11 Days,"Trip to Sydney, Auckland"
https://www.triphobo.com/tripplans/australia-itinerary-from-mumbai-56a9b9717547198a1f0001e9,268,16 Days,"Trip to Melbourne, Adelaide, Sydney, Broome, Geelong, Gold Coast, Canberra, Exmouth, Byron Bay, Rottnest Island"
https://www.triphobo.com/tripplans/australia-itinerary-568a1381fea23c6c06000052,266,18 Days,"Trip to Sydney, Cairns, Brisbane, Airlie Beach, Byron Bay, Uluru"
https://www.triphobo.com/tripplans/sydney/itinerary-from-cairns-56c6100e754719574c001064,265,14 Days,Trip to Sydney
https://www.triphobo.com/tripplans/hervey-bay-surfers-paradise-sydney-trip-from-mumbai-55f57d8d70e9d0c82400023a,264,7 Days,"Trip to Sydney, Hervey Bay, Surfers Paradise"
https://www.triphobo.com/tripplans/sydney/itinerary-from-gray-56a72efb8427a56c5d00005f,264,5 Days,Trip to Sydney
https://www.triphobo.com/tripplans/australia-itinerary-56938f34cd37729c080000e5,261,10 Days,"Trip to Melbourne, Sydney, Brisbane, Gold Coast"
https://www.triphobo.com/tripplans/australia-itinerary-from-bangalore-569406e3a6d46dbd76000158,257,9 Days,"Trip to Melbourne, Sydney, Cairns, Gold Coast"
https://www.triphobo.com/tripplans/melbourne-sydney-gold-coast-itinerary-from-delhi-5683b94c7b823aff0b000165,256,7 Days,"Trip to Melbourne, Sydney, Gold Coast"
https://www.triphobo.com/tripplans/sydney-hamilton-island-trip-from-hyderabad-55d7b15c6446cb9a0d000402,254,7 Days,"Trip to Sydney, Hamilton Island"
https://www.triphobo.com/tripplans/australia-trip-from-bangalore-55950c86fbc2e513260000be,252,14 Days,"Trip to Melbourne, Sydney, Cairns, Brisbane, Darwin, Canberra, Alice Springs, Hervey Bay, Uluru"
https://www.triphobo.com/tripplans/sydney/itinerary-from-brisbane-56b9bd768427a544220009f1,252,4 Days,Trip to Sydney
https://www.triphobo.com/tripplans/sydney-melbourne-itinerary-from-bangalore-5693c0e58527a54e120004c8,251,6 Days,"Trip to Melbourne, Sydney"
https://www.triphobo.com/tripplans/australia-itinerary-from-dubai-569414178527a5683b000f20,245,10 Days,"Trip to Melbourne, Perth, Sydney, Gold Coast, Surfers Paradise"
https://www.triphobo.com/tripplans/australia-itinerary-from-miami-beach-569570baa6d46dd75900019f,245,10 Days,"Trip to Melbourne, Sydney, Cairns, Brisbane"
https://www.triphobo.com/tripplans/sydney-hobart-trip-plan-5496ce2e6162632813000033,239,4 Days,"Trip to Sydney, Hobart"
https://www.triphobo.com/tripplans/australia-itinerary-56793a238427a5a82100081b,239,8 Days,"Trip to Melbourne, Sydney, Gold Coast, Surfers Paradise"
https://www.triphobo.com/tripplans/sydney-melbourne-itinerary-from-tampa-5682d2eda6d46de473000247,239,8 Days,"Trip to Melbourne, Sydney"
https://www.triphobo.com/tripplans/sydney/itinerary-from-melbourne-5691e39369ab71b02e0000f9,239,4 Days,Trip to Sydney
https://www.triphobo.com/tripplans/australia-itinerary-568b73b29bd33e0b4d000d1a,238,8 Days,"Trip to Melbourne, Adelaide, Perth, Sydney, Geelong, Gold Coast, Surfers Paradise, Byron Bay"
https://www.triphobo.com/tripplans/australia-itinerary-from-regina-569a99f169ab71c459000169,238,21 Days,"Trip to Melbourne, Sydney, Cairns, Airlie Beach, Byron Bay, Fraser Island, Uluru"
https://www.triphobo.com/tripplans/sydney-hobart-trip-plan-54dbf9e96162636465666768,236,4 Days,"Trip to Sydney, Hobart"
https://www.triphobo.com/tripplans/world-tour-trip-from-lisbon-555fbcc4f9c2e5a319000fd2,234,13 Days,"Trip to London, New York City, Sydney, Beijing, Istanbul, Pretoria"
https://www.triphobo.com/tripplans/australia-itinerary-from-sydney-56a74441c8ed6e7b71000011,233,23 Days,"Trip to Melbourne, Sydney, Cairns, Gold Coast, Fraser Island"
https://www.triphobo.com/tripplans/australia-new-zealand-itinerary-from-mumbai-566ecd918527a5eb25000675,232,14 Days,"Trip to Sydney, Whitianga, Rotorua, Auckland, Gold Coast, Wellington"
https://www.triphobo.com/tripplans/australia-trip-from-chandigarh-55c2e65000fc942e1a0003f8,230,9 Days,"Trip to Perth, Sydney, Geelong, Newcastle"
https://www.triphobo.com/tripplans/sydney-trip-plan-54e34e5efbc2e5d64c0003c8,228,1 Day,Trip to Sydney
https://www.triphobo.com/tripplans/sydney-byron-bay-trip-plan-553aca9ef9c2e52847001361,227,4 Days,"Trip to Sydney, Byron Bay"
https://www.triphobo.com/tripplans/australia-itinerary-from-kuala-lumpur-56c3ec1c8527a59f37000036,227,15 Days,"Trip to Melbourne, Adelaide, Perth, Sydney, Brisbane, Gold Coast, Canberra"
https://www.triphobo.com/tripplans/australia-itinerary-from-mumbai-56c16b0d5acb706572000217,226,17 Days,"Trip to Melbourne, Adelaide, Sydney, Cairns, Brisbane, Gold Coast, Kangaroo Island"
https://www.triphobo.com/tripplans/melbourne-sydney-gold-coast-itinerary-from-hong-kong-567a56e7a6d46d376d00081f,225,10 Days,"Trip to Melbourne, Sydney, Gold Coast"
https://www.triphobo.com/tripplans/australia-new-zealand-itinerary-from-new-york-city-568f0a1ca6d46deb01000034,224,16 Days,"Trip to Sydney, Rotorua, Auckland, Christchurch, Alice Springs"
https://www.triphobo.com/tripplans/australia-itinerary-from-jersey-city-5678b20ba6d46da64a00056a,223,12 Days,"Trip to Melbourne, Perth, Sydney, Gold Coast"
https://www.triphobo.com/tripplans/sydney/itinerary-from-mumbai-56bf5cc35acb70066b000676,223,32 Days,Trip to Sydney
https://www.triphobo.com/tripplans/asia-oceania-trip-from-beijing-55cddb12a5e4d0f85700004d,221,15 Days,"Trip to Seoul, Sydney, Beijing, Christchurch, Manila"
https://www.triphobo.com/tripplans/las-vegas-los-angeles-sydney-itinerary-from-toronto-561d3f1d8427a5f7520016b8,220,20 Days,"Trip to Las Vegas, Los Angeles, Sydney"
https://www.triphobo.com/tripplans/sydney-gold-coast-cairns-itinerary-from-london-5622a03586ccbe18080004cd,219,19 Days,"Trip to Sydney, Cairns, Gold Coast"
https://www.triphobo.com/tripplans/australia-itinerary-from-bangalore-56a9ff04bc6928c90e00087c,218,10 Days,"Trip to Melbourne, Sydney, Brisbane, Wagga Wagga, Kangaroo Island"
https://www.triphobo.com/tripplans/melbourne-cairns-sydney-itinerary-from-vancouver-564127815d31b91a1e000582,216,13 Days,"Trip to Melbourne, Sydney, Cairns"
https://www.triphobo.com/tripplans/asia-oceania-north-america-itinerary-from-london-5643da728a46cb1124000843,216,10 Days,"Trip to Mumbai, Tokyo, Seoul, Sydney, Ho Chi Minh City, Shanghai, Auckland, Mexico City, Suva, Bali"
https://www.triphobo.com/tripplans/sydney-perth-itinerary-from-bangalore-56716c3a5ecb705206000047,216,11 Days,"Trip to Perth, Sydney"
https://www.triphobo.com/tripplans/sydney/itinerary-from-warren-56a69fd4dd853a906600025c,215,6 Days,Trip to Sydney
https://www.triphobo.com/tripplans/sydney-trip-from-brisbane-5525616cfbc2e5cf730004b8,214,1 Day,Trip to Sydney
https://www.triphobo.com/tripplans/australia-itinerary-from-new-york-city-562ab0db5d31b9ba04000279,214,14 Days,"Trip to Sydney, Cairns, Brisbane, Gold Coast, Uluru, Hamilton Island"
https://www.triphobo.com/tripplans/sydney/itinerary-from-chicago-5674ac78a6d46d0d3d0006c2,211,14 Days,Trip to Sydney
https://www.triphobo.com/tripplans/sydney/itinerary-56ada9e5dd853ad837000083,211,4 Days,Trip to Sydney
https://www.triphobo.com/tripplans/sydney-broome-cessnock-trip-from-indian-wells-55361468e705450772000008,209,3 Days,"Trip to Sydney, Broome, Cessnock"
https://www.triphobo.com/tripplans/sydney-kuala-lumpur-bangkok-trip-from-christchurch-55f5171cf0d0bef20f000051,209,10 Days,"Trip to Bangkok, Sydney, Kuala Lumpur"
https://www.triphobo.com/tripplans/sydney-uluru-cairns-trip-from-paris-55aa5e48f3a73dc851000472,208,7 Days,"Trip to Sydney, Cairns, Uluru"
https://www.triphobo.com/tripplans/sydney/itinerary-from-antananarivo-567c05678527a5e63100060f,204,16 Days,Trip to Sydney
https://www.triphobo.com/tripplans/sydney-dubai-itinerary-from-london-569ff746a6d46db84b00060b,204,56 Days,"Trip to Sydney, Dubai"
https://www.triphobo.com/tripplans/sydney-hobart-trip-plan-524a5eef6162636465666768,203,3 Days,"Trip to Sydney, Hobart"
https://www.triphobo.com/tripplans/sydney-melbourne-itinerary-from-manila-569512166a01e3ee110000a0,203,15 Days,"Trip to Melbourne, Sydney"
